,percent,share,symbol,address,city,country,currency,cusip,description,employeeTotal,exchange,finnhubIndustry,ggroup,gind,gsector,gsubind,ipo,isin,logo,marketCapitalization,naics,naicsNationalIndustry,naicsSector,naicsSubsector,name,phone,sedol,shareOutstanding,state,weburl
128,0.175899,1735386,MCO,7 World Trade Ctr,New York City,US,USD,615369105,"Moody's Corp. engages in the provision of credit ratings, research, tools and analysis to the global capital markets. The company is headquartered in New York City, New York and currently employs 13,725 full-time employees. The firm operates in two segments: Moody's Investors Service (MIS) and Moody's Analytics (MA). The MIS segment includes its ratings operations. The MA segment develops a range of products and services that support financial analysis and risk management activities of institutional participants in financial markets. The MIS segment includes corporate finance group; structured finance group; financial institutions group; public, project and infrastructure finance, and MIS Other. The MA segment consists of three lines of business: data and analytics business, enterprise risk solutions and professional service.",11363,"NEW YORK STOCK EXCHANGE, INC.",Financial Services,Diversified Financials,Capital Markets,Financials,Financial Exchanges & Data,1998-06-19,US6153691059,https://static.finnhub.io/logo/21b77074-80ec-11ea-a2fe-00000000092a.png,51715.11,Business Support Services,Credit Bureaus,Administrative and Support and Waste Management and Remediation Services,Administrative and Support Services,Moody's Corp,12125530300,2252058,187.7,NEW YORK,https://www.moodys.com/
129,0.171683,1753411,BIIB,225 Binney St,Cambridge,US,USD,09062X103,"Biogen, Inc. is a biopharmaceutical company, which engages in discovering, developing, and delivering therapies for neurological and neurodegenerative diseases. The company is headquartered in Cambridge, Massachusetts and currently employs 7,800 full-time employees. The firm focuses on discovering, developing, manufacturing and delivering therapies to people living with serious neurological, rare and autoimmune diseases. The firm markets products, including TECFIDERA, AVONEX, PLEGRIDY, TYSABRI, ZINBRYTA and FAMPYRA for multiple sclerosis (MS), FUMADERM for the treatment of severe plaque psoriasis and SPINRAZA for the treatment of spinal muscular atrophy (SMA). The company also has a collaboration agreement with Genentech, Inc. (Genentech), a member of the Roche Group, with respect to RITUXAN for the treatment of non-Hodgkin's lymphoma, chronic lymphocytic leukemia (CLL) and other conditions, GAZYVA indicated for the treatment of CLL and follicular lymphoma, and other anti-CD20 therapies. The firm's product candidate includes OCREVUS; Biosimilar adalimumab; Aducanumab; E2609; BIIB074; BAN2401; Opicinumab; CIRARA; BIIB061; BIIB054; BIIB067, and BIIB068.",7400,NASDAQ NMS - GLOBAL MARKET,Biotechnology,"Pharmaceuticals, Biotechnology & Life Sciences",Biotechnology,Health Care,Biotechnology,1991-09-17,US09062X1037,https://static.finnhub.io/logo/4eb95aee-80e0-11ea-a580-00000000092a.png,48398.01,Scientific Research and Development Services,"Research and Development in the Physical, Engineering, and Life Sciences (except Biotechnology)","Professional, Scientific, and Technical Services","Professional, Scientific, and Technical Services",Biogen Inc,17814642000,2455965,158.313471,MASSACHUSETTS,https://www.biogen.com/
130,0.168467,2415227,EL,767 5th Ave,New York City,US,USD,518439104,"The Estée Lauder Companies, Inc. engages in the manufacturing of skin care, makeup, fragrance and hair care products. The company is headquartered in New York City, New York and currently employs 48,000 full-time employees. The firm offers products, including skin care, makeup, fragrance, hair care and other. The firm operates in beauty products segment. The firm's products are sold in over 150 countries and territories under brand names, including Estee Lauder, Aramis, Clinique, Prescriptives, Lab Series, Origins, Tommy Hilfiger, MAC, Kiton, La Mer, Bobbi Brown, Donna Karan New York, DKNY, Aveda, Jo Malone London, Bumble and bumble, Michael Kors, Darphin, Tom Ford, Smashbox, Ermenegildo Zegna, AERIN, Tory Burch, RODIN olio lusso, Le Labo, Editions de Parfums Frederic Malle, GLAMGLOW, By Kilian, BECCA and Too Faced. Its skin care products include moisturizers, serums, cleansers, toners, body care, exfoliators, acne and oil correctors, facial masks, cleansing devices and sun care products.",48000,"NEW YORK STOCK EXCHANGE, INC.",Consumer products,Household & Personal Products,Personal Products,Consumer Staples,Personal Products,1995-11-17,US5184391044,,71726.13,"Soap, Cleaning Compound, and Toilet Preparation Manufacturing",Toilet Preparation Manufacturing,Manufacturing,Chemical Manufacturing,Estee Lauder Companies Inc,12125724200,2320524,359.998626,NEW YORK,https://www.elcompanies.com/
131,0.167871,11523580,COP,925 N Eldridge Pkwy,Houston,US,USD,20825C104,"ConocoPhillips engages in the exploration, production, transportation and marketing of crude oil, bitumen, natural gas, natural gas liquids and liquefied natural gas on a worldwide basis. The company is headquartered in Houston, Texas and currently employs 10,400 full-time employees. The firm explores for, produces, transports and markets crude oil, bitumen, natural gas, liquefied natural gas (LNG) and natural gas liquids. The firm operates through six segments: Alaska, Lower 48, Canada, Europe and North Africa, Asia Pacific and Middle East, and Other International. The Alaska segment explores for, produces, transports and markets crude oil, natural gas liquids, natural gas and LNG. The Lower 48 segment consists of operations located in the United States Lower 48 states and the Gulf of Mexico. Its Canadian operations consists of oil sands developments in the Athabasca Region of northeastern Alberta. The Europe and North Africa segment consists of operations and exploration activities in Norway and Libya. The Asia Pacific and Middle East segment has exploration and production operations in China, Indonesia, Malaysia and Australia.",10400,"NEW YORK STOCK EXCHANGE, INC.",Energy ,Energy,"Oil, Gas & Consumable Fuels",Energy,Oil & Gas Exploration & Production,2002-09-03,US20825C1045,https://static.finnhub.io/logo/aacfcb5e-80eb-11ea-8e60-00000000092a.png,40811.14,Oil and Gas Extraction,Crude Petroleum and Natural Gas Extraction,Mining,Oil and Gas Extraction,ConocoPhillips,12812931000,2685717,1072.56621,TEXAS,http://www.conocophillips.com/
132,0.16778,6666772,EW,1 Edwards Way,Irvine,US,USD,28176E108,"Edwards Lifesciences Corp. engages in the patient-focused medical innovations for heart disease and critical care monitoring. The company is headquartered in Irvine, California and currently employs 12,800 full-time employees. The firm is engaged in patient-focused innovations for structural heart disease and critical care monitoring. Its segments include United States, Europe, Japan and Rest of World. Its products are categorized into three areas: Transcatheter Heart Valve Therapy, Surgical Heart Valve Therapy and Critical Care. The company also develops hemodynamic monitoring systems that are used to measure a patient's cardiovascular function in the hospital setting. The company is developing products, such as the Edwards SAPIEN 3 Ultra System and Edwards SAPIEN XT transcatheter heart valve, among others. Its Transcatheter Heart Valve Therapy and Surgical Heart Valve Therapy products are manufactured in the United States, Singapore and Switzerland. Critical Care products are manufactured in its facilities located in Puerto Rico and the Dominican Republic.",13900,"NEW YORK STOCK EXCHANGE, INC.",Health Care,Health Care Equipment & Services,Health Care Equipment & Supplies,Health Care,Health Care Equipment,2000-03-27,US28176E1082,https://static.finnhub.io/logo/d54ba950-80eb-11ea-b652-00000000092a.png,47836.72,"Navigational, Measuring, Electromedical, and Control Instruments Manufacturing",Electromedical and Electrotherapeutic Apparatus Manufacturing,Manufacturing,Computer and Electronic Product Manufacturing,Edwards Lifesciences Corp,19492502500,2567116,621.740581,CALIFORNIA,https://www.edwards.com
133,0.167648,4558819,PNC,300 5th Ave,Pittsburgh,US,USD,693475105,"PNC Financial Services Group, Inc. is a holding company, which engages in the provision of financial services. The company is headquartered in Pittsburgh, Pennsylvania and currently employs 50,928 full-time employees. The firm has businesses engaged in retail banking, including residential mortgage, corporate and institutional banking and asset management. The firm operates through four segments: Retail Banking, Corporate & Institutional Banking, Asset Management Group, and BlackRock. Retail Banking provides deposit, lending, brokerage, investment management and cash management products and services. Corporate & Institutional Banking provides lending, treasury management and capital markets-related products and services. Asset Management Group includes personal wealth management for high net worth and ultra-high net worth clients and institutional asset management. BlackRock, in which the Company holds an equity investment, is a publicly traded investment management firm providing investment and risk management services to institutional and retail clients across the world.",50017,"NEW YORK STOCK EXCHANGE, INC.",Banking,Banks,Banks,Financials,Regional Banks,1987-10-21,US6934751057,https://static.finnhub.io/logo/595585fe-80ec-11ea-9ee3-00000000092a.png,46567.96,Depository Credit Intermediation,Commercial Banking,Finance and Insurance,Credit Intermediation and Related Activities,PNC Financial Services Group Inc,18887622265,2692665,424.502851,PENNSYLVANIA,https://www.pnc.com/
134,0.163898,5453004,BAX,1 Baxter Pkwy,Deerfield,US,USD,071813109,"Baxter International, Inc. provides portfolio of essential renal and hospital products, including acute and chronic dialysis, sterile IV solutions, infusion systems and devices, parenteral nutrition therapies; premixed and oncolytic injectable, bio surgery products and anesthetics, drug reconstitution systems and pharmacy automation, software and services. The company is headquartered in Deerfield, Illinois and currently employs 50,000 full-time employees. The firm operates through two segments: Hospital Products and Renal. Its Hospital Products business manufactures sterile intravenous (IV) solutions and administration sets, premixed drugs and drug-reconstitution systems, pre-filled vials and syringes for injectable drugs, IV nutrition products, parenteral nutrition therapies, infusion pumps, inhalation anesthetics and biosurgery products. The Renal business offers a portfolio to meet the needs of patients with end-stage renal disease, or irreversible kidney disease and acute kidney injuries, including technologies and therapies for peritoneal dialysis (PD), hemodialysis (HD), continuous renal replacement therapy (CRRT) and additional dialysis services. Its products are used by hospitals, kidney dialysis centers, nursing homes, rehabilitation centers, doctors' offices and by patients at home under physician supervision.",50000,"NEW YORK STOCK EXCHANGE, INC.",Health Care,Health Care Equipment & Services,Health Care Equipment & Supplies,Health Care,Health Care Equipment,1961-05-15,US0718131099,https://static.finnhub.io/logo/7fd00f9c-80eb-11ea-95bb-00000000092a.png,40685.84,Medical Equipment and Supplies Manufacturing,Surgical and Medical Instrument Manufacturing,Manufacturing,Miscellaneous Manufacturing,Baxter International Inc,18479482000,2085102,506.231732,ILLINOIS,https://www.baxter.com/
135,0.159919,3936570,ADI,1 Technology Way,Norwood,US,USD,032654105,"Analog Devices, Inc. engages in the design, development, manufacture, and marketing of integrated circuits (ICs). The company is headquartered in Norwood, Massachusetts and currently employs 16,400 full-time employees. Its products include Analog Products, Converters, Amplifiers/Radio Frequency, Other Analog, Power Management and Reference, and Digital Signal Processing Products. The firm is a supplier of data converter products. The firm is a supplier of high-performance amplifiers. Its analog product line also includes products of high performance radio frequency (RF) ICs. The firm's DSPs are used for high-speed numeric calculations. The firm offers its products for applications in various end markets, such as industrial, automotive, consumer and communications. The firm operates in the United States, Rest of North/South America, Europe, Japan and China.",16400,NASDAQ NMS - GLOBAL MARKET,Semiconductors,Semiconductors & Semiconductor Equipment,Semiconductors & Semiconductor Equipment,Information Technology,Semiconductors,1979-04-03,US0326541051,https://static.finnhub.io/logo/638498fa-80eb-11ea-8d04-00000000092a.png,43071.74,Semiconductor and Other Electronic Component Manufacturing,Semiconductor and Related Device Manufacturing,Manufacturing,Computer and Electronic Product Manufacturing,Analog Devices Inc,17813294700,2032067,368.954425,MASSACHUSETTS,http://www.analog.com/
136,0.157684,1110353,ROP,"6901 Professional Pkwy East, Suite 200",Sarasota,US,USD,776696106,"Roper Technologies, Inc. is diversified technology company, which engages in the provision of engineered products and solutions for the global niche markets. The company is headquartered in Lakewood Ranch, Florida and currently employs 15,611 full-time employees. The firm operate businesses that design and develop software, including both license and software-as-a-service (SaaS) and engineered products and solutions for a variety of markets. The company operates through four segments: Application software, Network Software & Systems, Measurement & Analytical solutions and Process Technologies. The company provides a broad portfolio of products, solutions and services, including campus card and cashless systems, laboratory information management solutions, enterprise software and information solutions, preconstruction software, wireless sensor networks, SaaS-based trading network and business intelligence solutions, precision rubber and polymer laboratory instrumentation, data acquisition, data analysis software systems, valves and controls for industrial refrigeration systems, control, safety and hazardous area solutions, and rotary positive displacement technology based fluid handling solutions.",16460,"NEW YORK STOCK EXCHANGE, INC.",Industrial Conglomerates,Capital Goods,Industrial Conglomerates,Industrials,Industrial Conglomerates,1996-11-01,US7766961061,https://static.finnhub.io/logo/6649ef38-80ec-11ea-a694-00000000092a.png,45619.24,Communications Equipment Manufacturing,Radio and Television Broadcasting and Wireless Communications Equipment Manufacturing,Manufacturing,Computer and Electronic Product Manufacturing,Roper Technologies Inc,19415562601,2749602,104.710813,FLORIDA,http://www.ropertech.com/
137,0.157361,5279834,AEP,1 Riverside Plz,Columbus,US,USD,025537101,"American Electric Power Co., Inc. is a public utility holding company that engages in the business of generation, transmission and distribution of electricity. The company is headquartered in Columbus, Ohio and currently employs 17,582 full-time employees. The service areas of the Company's public utility subsidiaries cover the states of Arkansas, Indiana, Kentucky, Louisiana, Michigan, Ohio, Oklahoma, Tennessee, Texas, Virginia and West Virginia. The firm's segments include Vertically Integrated Utilities, Transmission and Distribution Utilities, AEP Transmission Holdco, and Generation & Marketing. AEP's vertically integrated utility operations are engaged in the generation, transmission and distribution of electricity for sale to retail and wholesale customers. Transmission and Distribution Utilities segment consists of the transmission and distribution of electricity for sale to retail and wholesale customers. AEP Transmission Holdco develops, constructs and operates transmission facilities.",17408,"NEW YORK STOCK EXCHANGE, INC.",Utilities,Utilities,Electric Utilities,Utilities,Electric Utilities,1949-09-01,US0255371017,https://static.finnhub.io/logo/65ca8abe-80eb-11ea-9cac-00000000092a.png,42307.93,"Electric Power Generation, Transmission and Distribution",Electric Power Distribution,Utilities,Utilities,American Electric Power Company Inc,16147161000,2026242,496.010572,OHIO,http://www.aep.com/
138,0.156905,4168609,WM,1001 Fannin St,Houston,US,USD,94106L109,"Waste Management, Inc. engages in the provision of waste management environmental services. The company is headquartered in Houston, Texas and currently employs 43,700 full-time employees. The Company, through its subsidiaries, is a provider of waste management environmental services. The firm's segments include Solid Waste and Other. The firm's Solid Waste segment includes its solid waste business. The Other segment includes its Strategic Business Solutions (WMSBS) organization; its landfill gas-to-energy operations and third-party subcontract and administration services managed by its Energy and Environmental Services and WM Renewable Energy organizations; its recycling brokerage services, and its service offerings and solutions, such as portable self-storage and long distance moving services, fluorescent lamp recycling and interests it holds in oil and gas producing properties. As of December 31, 2016, the Company owned or operated 243 solid waste landfills and five secure hazardous waste landfills. Its recycling brokerage services involve managing the marketing of recyclable materials for third parties.",44900,"NEW YORK STOCK EXCHANGE, INC.",Commercial Services & Supplies,Commercial  & Professional Services,Commercial Services & Supplies,Industrials,Environmental & Facilities Services,1993-07-20,US94106L1098,https://static.finnhub.io/logo/a3d670b8-80ec-11ea-bd29-00000000092a.png,46627.04,Waste Collection,Solid Waste Collection,Administrative and Support and Waste Management and Remediation Services,Waste Management and Remediation Services,Waste Management Inc,17135126200,2937667,422.461187,TEXAS,https://www.wm.com/
139,0.151895,7916302,DD,974 Centre Rd Bldg 730,Wilmington,US,USD,26614N102,"DuPont de Nemours, Inc. operates as a holding company, which engages in the development of specialty materials, chemicals, and agricultural products. The company is headquartered in Wilmington, Delaware and currently employs 98,000 full-time employees. The firm offers its products and solutions across four businesses: Electronics and Imaging, Nutrition and Biosciences, Safety and Construction, and Transportation and Industrial. The company offers products under various brands, such as Kevlar, Nomex, Tyvek, Sorona, Danisco, Corian, GREAT STUFF and Styrofoam. Its product lines include adhesives, animal nutrition, biomaterials, clean technologies, construction materials, consumer products, electronic solutions, dietary supplements, water solution, microbial control solutions, industrial enzymes and bioactives, packaging materials and solutions, and medical devices and materials. The company provides solutions to a range of markets, including automotive, building and construction, energy, government and public sector, military, law enforcement, emergency response, packaging and printing, and safety and protection industries.",35000,"NEW YORK STOCK EXCHANGE, INC.",Chemicals,Materials,Chemicals,Materials,Specialty Chemicals,2017-09-01,US26614N1028,,40998.95,"Paint, Coating, and Adhesive Manufacturing",Adhesive Manufacturing,Manufacturing,Chemical Manufacturing,Dupont De Nemours Inc,13027741000,BK0VN47,733.827575,DELAWARE,https://www.dupont.com/
140,0.150867,3120037,EA,209 Redwood Shores Pkwy,Redwood City,US,USD,285512109,"Electronic Arts, Inc. develops, markets, publishes, and distributes games, content, and services for game consoles, PCs, mobile phones, and tablets worldwide. The company is headquartered in Redwood City, California and currently employs 9,700 full-time employees. The firm's games and services are based on a portfolio of intellectual property that includes established brands, such as FIFA, Madden NFL, Star Wars, Battlefield, the Sims and Need for Speed. The firm markets and sells its games and services through retail channels and through digital distribution channels. The firm's PC games and additional content can be downloaded directly through its Origin online platform, as well as through third-party online download stores. Its mobile, tablet and PC free-to-download games and additional content are available through third-party application storefronts, such as the Apple Application Store and Google Play.",9800,NASDAQ NMS - GLOBAL MARKET,Media,Media & Entertainment,Entertainment,Communication Services,Interactive Home Entertainment,1989-01-09,US2855121099,https://static.finnhub.io/logo/556815ac-80e0-11ea-bb14-00000000092a.png,42426.58,Software Publishers,Software Publishers,Information,Publishing Industries (except Internet),Electronic Arts Inc,16506281500,2310194,288.714378,CALIFORNIA,https://www.ea.com/
141,0.14947,12220309,SCHW,211 Main St,San Francisco,US,USD,808513105,"The Charles Schwab Corp. is a savings and loan holding company, which engages in the provision of wealth management, securities brokerage, banking, asset management, custody, and financial advisory services. The company is headquartered in San Francisco, California and currently employs 19,800 full-time employees. The Company, through its subsidiaries, engages in wealth management, securities brokerage, banking, money management and financial advisory services. The firm provides financial services to individuals and institutional clients through two segments: Investor Services and Advisor Services. The Investor Services segment provides retail brokerage and banking services, retirement plan services and other corporate brokerage services. The Advisor Services segment provides custodial, trading, and support services as well as retirement business services. The firm offers a range of products to address individuals' varying investment and financial needs. Its product offerings include brokerage, mutual funds, ETFs, advice solutions, banking and trust. Brokerage provides a range of brokerage accounts with cash management capabilities. Mutual funds offer third-party mutual funds through the Mutual Fund Marketplace.",20200,"NEW YORK STOCK EXCHANGE, INC.",Financial Services,Diversified Financials,Capital Markets,Financials,Investment Banking & Brokerage,2010-03-05,US8085131055,https://static.finnhub.io/logo/867fa080-80e0-11ea-9be1-00000000092a.png,42664.86,Securities and Commodity Contracts Intermediation and Brokerage,Securities Brokerage,Finance and Insurance,"Securities, Commodity Contracts, and Other Financial Investments and Related Activities",Charles Schwab Corp,14156677000,2779397,1287.412923,CALIFORNIA,http://www.aboutschwab.com/
142,0.148605,2554257,FDX,942 Shady Grove Rd S,Memphis,US,USD,31428X106,"FedEx Corp. is a holding company, which engages in the provision of a portfolio of transportation, e-commerce, and business services. The company is headquartered in Memphis, Tennessee and currently employs 177,000 full-time employees. The firm's segments include FedEx Express, TNT Express, FedEx Ground, FedEx Freight and FedEx Services. The FedEx Express segment offers a range of the United States domestic and international shipping services for delivery of packages and freight. TNT Express segment collects, transports and delivers documents, parcels and freight on a day-definite or time-definite basis. The FedEx Ground segment provides business and residential money-back guaranteed ground package delivery services. The FedEx Freight segment offers less-than-truckload (LTL) freight services. The FedEx Services segment provides its other companies with sales, marketing, information technology, communications, customer service and other back-office support.",177000,"NEW YORK STOCK EXCHANGE, INC.",Logistics & Transportation,Transportation,Air Freight & Logistics,Industrials,Air Freight & Logistics,1978-12-28,US31428X1063,https://static.finnhub.io/logo/db346594-80eb-11ea-a0d5-00000000092a.png,45119.04,Couriers and Express Delivery Services,Couriers and Express Delivery Services,Transportation and Warehousing,Couriers and Messengers,FedEx Corp,19018187500,2142784,261.954496,TENNESSEE,http://www.fedex.com/
