,percent,share,symbol,address,city,country,currency,cusip,description,employeeTotal,exchange,finnhubIndustry,ggroup,gind,gsector,gsubind,ipo,isin,logo,marketCapitalization,naics,naicsNationalIndustry,naicsSector,naicsSubsector,name,phone,sedol,shareOutstanding,state,weburl
364,0.043871,582232,ANET,5453 Great America Pkwy,Santa Clara,US,USD,040413106,"Arista Networks, Inc. engages in the development, marketing, and sale of cloud networking solutions. The company is headquartered in Santa Clara, California and currently employs 2,300 full-time employees. The company develops, markets and sells cloud networking solutions, which consist of its Gigabit Ethernet switches and related software. The firm's cloud networking solutions consist of its Extensible Operating System (EOS), a set of network applications and its Ethernet switching and routing platforms. The programmability of EOS has allowed it to create a set of software applications that address the requirements of cloud networking, including workflow automation, network visibility and analytics, and has also allowed it to integrate with a range of third-party applications for virtualization, management, automation, orchestration and network services. EOS supports cloud and virtualization solutions, including VMware NSX, Microsoft System Center and other cloud management frameworks.",2300,"NEW YORK STOCK EXCHANGE, INC.",Communications,Technology Hardware & Equipment,Communications Equipment,Information Technology,Communications Equipment,2014-06-06,US0404131064,https://static.finnhub.io/logo/5c1639fa-81b4-11ea-a6d0-00000000092a.png,17546.71,Semiconductor and Other Electronic Component Manufacturing,Other Electronic Component Manufacturing,Manufacturing,Computer and Electronic Product Manufacturing,Arista Networks Inc,14085475500,BN33VM5,76.0256,CALIFORNIA,https://www.arista.com/en/
365,0.043703,37300,NVR,11700 Plaza America Dr Ste 500,Reston,US,USD,62944T105,"NVR, Inc. engages in the construction and sale of single-family detached homes, townhomes and condominium buildings. The company is headquartered in Reston, Virginia and currently employs 5,600 full-time employees. The firm's segments are Homebuilding Mid Atlantic, Homebuilding North East, Homebuilding Mid East, Homebuilding South East and Mortgage Banking. Its Homebuilding Mid Atlantic segment operates in various geographic regions, which include Maryland, Virginia, West Virginia, Delaware and Washington, District of Columbia (D.C.). Its Homebuilding North East segment operates in various geographic regions, which include New Jersey and Eastern Pennsylvania. Its Homebuilding Mid East segment operates in various geographic regions, which include New York, Ohio, Indiana and Illinois, The Homebuilding South East segment operates in various geographic regions, which include North Carolina, South Carolina, Florida and Tennessee. The Mortgage Banking segment provides mortgage-related services to home building customers through its mortgage banking operations.",5700,"NEW YORK STOCK EXCHANGE, INC.",Consumer products,Consumer Durables & Apparel,Household Durables,Consumer Discretionary,Homebuilding,2008-01-02,US62944T1051,https://static.finnhub.io/logo/432bfe4c-80ec-11ea-8f50-00000000092a.png,14346.78,Residential Building Construction,New Single-Family Housing Construction (except Operative Builders),Construction,Construction of Buildings,NVR Inc,17039564000,2637785,3.702385,VIRGINIA,http://www.nvrinc.com/
366,0.043636,613144,ULTA,1000 Remington Blvd Ste 120,Bolingbrook,US,USD,90384S303,"Ulta Beauty, Inc. is a beauty retailer of cosmetics, fragrance, skin care and hair care products. The company is headquartered in Bolingbrook, Illinois and currently employs 16,000 full-time employees. The firm is a beauty retailer. The firm offers cosmetics, fragrance, skin, hair care products and salon services. The firm offers approximately 20,000 products from over 500 beauty brands across all categories, including the Company’s own private label. The firm also offers a full-service salon in every store featuring hair, skin and brow services. The firm operates approximately 970 retail stores across over 48 states and the District of Columbia and also distributes its products through its Website, which includes a collection of tips, tutorials and social content. The firm offers makeup products, such as foundation, face powder, concealer, color correcting, face primer, blush, bronzer, contouring, highlighter, setting spray, shampoos, conditioners, hair styling products, hair styling tools and perfumes. The firm also offers makeup brushes and tools, and makeup bags and cases.",18000,NASDAQ NMS - GLOBAL MARKET,Retail,Retailing,Specialty Retail,Consumer Discretionary,Specialty Stores,2007-10-25,US90384S3031,https://static.finnhub.io/logo/d10866ba-80e0-11ea-9adf-00000000092a.png,11488.15,Health and Personal Care Stores,"Cosmetics, Beauty Supplies, and Perfume Stores",Retail Trade,Health and Personal Care Stores,Ulta Beauty Inc,16304104800,B28TS42,56.311711,ILLINOIS,http://www.ulta.com/
367,0.043499,1445572,CHRW,14701 Charlson Rd,Eden Prairie,US,USD,12541W209,"C.H.Robinson Worldwide, Inc. engages in the provision of freight transportation services and logistics solutions. The company is headquartered in Eden Prairie, Minnesota and currently employs 15,262 full-time employees. Robinson Worldwide, Inc. is a provider of transportation services and logistics solutions through a network of offices operating in North America, Europe, Asia, Australia, New Zealand and South America. The firm's segments include North American Surface Transportation (NAST), Global Forwarding, Robinson Fresh, and All Other and Corporate. The NAST segment provides freight transportation services across North America through a network of offices in the United States, Canada and Mexico. The primary services provided by Global Forwarding segment include ocean freight services, air freight services, and customs brokerage. The Robinson Fresh segment provides sourcing under the trade name Robinson Fresh. The All Other and Corporate segment primarily consists of Managed Services and Other Surface Transportation outside of North America. The company develops global transportation and distribution networks to provide transportation and supply chain services throughout the world.",15450,NASDAQ NMS - GLOBAL MARKET,Logistics & Transportation,Transportation,Air Freight & Logistics,Industrials,Air Freight & Logistics,1997-10-15,US12541W2098,https://static.finnhub.io/logo/390745f6-80e0-11ea-8529-00000000092a.png,12829.79,Freight Transportation Arrangement,Freight Transportation Arrangement,Transportation and Warehousing,Support Activities for Transportation,CH Robinson Worldwide Inc,19529378500,2116228,134.823403,MINNESOTA,https://www.chrobinson.com/
368,0.043349,2764978,PFG,711 High St,Des Moines,US,USD,74251V102,"Principal Financial Group, Inc. is a financial company, which offers financial products and services to businesses, individuals and institutional clients. The company is headquartered in Des Moines, Iowa and currently employs 16,475 full-time employees. The firm offers a range of financial products and services, including retirement, asset management and insurance. Its segments include Retirement and Income Solutions; Principal Global Investors, Principal International; U.S. Insurance Solutions, and Corporate. The firm offers a portfolio of products and services for retirement savings and retirement income. The firm's Principal Global Investors segment manages assets for investors around the world. The firm offers pension accumulation products and services, mutual funds, asset management, income annuities and life insurance accumulation products. The firm's U.S. Insurance Solutions segment provides group and individual insurance solutions. The company focuses on small and medium-sized businesses, providing a range of retirement and employee benefit solutions, and individual insurance solutions to meet the needs of the business owners and their employees.",17601,NASDAQ NMS - GLOBAL MARKET,Insurance,Insurance,Insurance,Financials,Life & Health Insurance,2001-10-23,US74251V1026,https://static.finnhub.io/logo/52a59ab6-80ec-11ea-b750-00000000092a.png,11790.58,Insurance Carriers,Direct Health and Medical Insurance Carriers,Finance and Insurance,Insurance Carriers and Related Activities,Principal Financial Group Inc,15152475111,2803014,274.518698,IOWA,http://www.principal.com/
369,0.043234,1425641,LDOS,1750 PRESIDENTS STREET,Reston,US,USD,525327102,"Leidos Holdings, Inc. is a holding company, which engages in the provision of scientific, engineering and information technology services and solutions in the areas of defense, intelligence, civil and health markets. The company is headquartered in Reston, Virginia and currently employs 32,000 full-time employees. The firm provides technology and engineering services and solutions in the defense, intelligence, civil and health markets. Its segments include National Security Solutions (NSS), Information Systems & Global Solutions (IS&GS), Health and Infrastructure (HIS), and Corporate and Other. The NSS segment provides a portfolio of national security solutions and systems. The IS&GS segment focuses on providing information technology, management and engineering services to civil, defense and intelligence agencies of the United States government. HIS segment serves customers, including the United States federal government, state and local governmental agencies, foreign governments, healthcare providers and commercial enterprises. Its infrastructure business is focused on integrating and protecting physical, digital and data domains. The Corporate and Other segment includes the operations of various corporate activities.",34000,"NEW YORK STOCK EXCHANGE, INC.",Technology,Software & Services,IT Services,Information Technology,IT Consulting & Other Services,2006-10-13,US5253271028,https://static.finnhub.io/logo/6a70aab0-80ec-11ea-b140-00000000092a.png,13253.86,Computer Systems Design and Related Services,Computer Systems Design Services,"Professional, Scientific, and Technical Services","Professional, Scientific, and Technical Services",Leidos Holdings Inc,15715266000,BDV82B8,142.193551,VIRGINIA,https://www.leidos.com/
370,0.043161,9413596,HAL,3000 N Sam Houston Pkwy E,Houston,US,USD,406216101,"Halliburton Co. engages in the provision of services and products to the energy industry related to the exploration, development, and production of oil and natural gas. The company is headquartered in Houston, Texas and currently employs 60,000 full-time employees. The company operates through two segments: the Completion and Production segment, and the Drilling and Evaluation segment. The Completion and Production segment delivers cementing, stimulation, intervention, pressure control, specialty chemicals, artificial lift and completion services. The Drilling and Evaluation segment provides field and reservoir modeling, drilling, evaluation and wellbore placement solutions that enable customers to model, measure, drill and optimize their well construction activities. The company serves national and independent oil and natural gas companies. As of December 31, 2016, it had conducted business in approximately 70 countries around the world.",50000,"NEW YORK STOCK EXCHANGE, INC.",,Energy,Energy Equipment & Services,Energy,Oil & Gas Equipment & Services,1948-09-15,US4062161017,,13018.93,Support Activities for Mining,Support Activities for Oil and Gas Operations,Mining,Support Activities for Mining,Halliburton Co,12818712699,2405302,878.470401,TEXAS,https://www.halliburton.com/en-US/default.html
371,0.043086,1622586,CINF,6200 S Gilmore Rd,Fairfield,US,USD,172062101,"Cincinnati Financial Corp. provides property casualty and life insurance services. The company is headquartered in Fairfield, Ohio and currently employs 4,999 full-time employees. The company operates through five segments: Commercial lines insurance, Personal lines insurance, Excess and surplus lines insurance, and Life insurance and Investments. Its Commercial Lines Insurance Segment provides five commercial business lines: commercial casualty, commercial property, commercial auto, workers' compensation and other commercial lines. Its personal lines property insurance segment writes personal lines coverage in accounts that include both auto and homeowner coverages, as well as coverages that are part of its other personal business line. The excess and surplus lines Insurance segment covers business risks with characteristics, such as the nature of the business or its claim history that are difficult to profitably insure in the standard commercial lines market. The life insurance business lines include term life insurance, universal life insurance, worksite products and whole life insurance.",5148,NASDAQ NMS - GLOBAL MARKET,Insurance,Insurance,Insurance,Financials,Property & Casualty Insurance,1980-03-17,US1720621010,https://static.finnhub.io/logo/78f04730-80e0-11ea-9b3b-00000000092a.png,12779.81,Insurance Carriers,Direct Property and Casualty Insurance Carriers,Finance and Insurance,Insurance Carriers and Related Activities,Cincinnati Financial Corp,15138702000,2196888,160.853505,OHIO,https://www.cinfin.com/
372,0.042953,773982,URI,100 Stamford Pl Fl 7,Stamford,US,USD,911363109,"United Rentals, Inc. engages in the equipment rental business. The company is headquartered in Stamford, Connecticut and currently employs 18,500 full-time employees. The firm is an equipment rental company, which operates throughout the United States and Canada. The company operates through two segments: general rentals, and trench, power and pump. The general rentals segment includes the rental of construction, aerial, industrial and homeowner equipment and related services and activities. The trench, power and pump segment includes the rental of specialty construction products and related services. Its general rentals segment includes the rental of general construction and industrial equipment, such as backhoes, skid-steer loaders, forklifts and material handling equipment; aerial work platforms, such as boom lifts and scissor lifts, and general tools and light equipment, such as pressure washers, water pumps and power tools. As of October 17, 2018, it operated 1075 rental locations. The company conducts its operations through its subsidiary, United Rentals (North America), Inc. (URNA) and subsidiaries of URNA.",19100,"NEW YORK STOCK EXCHANGE, INC.",Trading Companies & Distributors,Capital Goods,Trading Companies & Distributors,Industrials,Trading Companies & Distributors,1997-12-18,US9113631090,https://static.finnhub.io/logo/93d2840c-80ec-11ea-af66-00000000092a.png,12512.42,Commercial and Industrial Machinery and Equipment Rental and Leasing,"Construction, Mining, and Forestry Machinery and Equipment Rental and Leasing",Real Estate Rental and Leasing,Rental and Leasing Services,United Rentals Inc,12036223131,2134781,72.080277,CONNECTICUT,https://www.unitedrentals.com/
373,0.042928,972305,VAR,3100 Hansen Way Bldg 4A,Palo Alto,US,USD,92220P105,"Varian Medical Systems, Inc. engages in the manufacture of medical devices and software for treating cancer and other medical conditions. The company is headquartered in Palo Alto, California and currently employs 10,062 full-time employees. The firm also has Varian Particle Therapy (VPT) and the operations of the Ginzton Technology Center (GTC). Its VPT business develops, designs, manufactures, sells and services products and systems for delivering proton therapy, another form of external beam radiotherapy using proton beams for the treatment of cancer. Its ProBeam system is capable of delivering intensity modulated proton therapy (IMPT) using pencil beam scanning technology. Its ProBeam Compact is a single room proton therapy product. Through its subsidiary, Cooperative CL Enterprises, the Company distributes radiotherapy equipments in Taiwan.",10062,"NEW YORK STOCK EXCHANGE, INC.",Health Care,Health Care Equipment & Services,Health Care Equipment & Supplies,Health Care,Health Care Equipment,1959-09-14,US92220P1057,https://static.finnhub.io/logo/96e7909a-80ec-11ea-a129-00000000092a.png,15741.56,"Navigational, Measuring, Electromedical, and Control Instruments Manufacturing",Electromedical and Electrotherapeutic Apparatus Manufacturing,Manufacturing,Computer and Electronic Product Manufacturing,Varian Medical Systems Inc,16504934000,2927516,90.944377,CALIFORNIA,https://www.varian.com/
374,0.042672,553313,SIVB,3003 TASMAN DR,Santa Clara,US,USD,78486Q101,"SVB Financial Group is a holding company, which engages in the provision of banking and financial services. The company is headquartered in Santa Clara, California and currently employs 3,460 full-time employees. The firm's segments include Global Commercial Bank, SVB Private Bank and SVB Capital. The Global Commercial Bank segment consists of the operations of its Commercial Bank, and of SVB Wine, SVB Analytics and its Debt Fund Investments. SVB Private Bank is the private banking division of the Bank, which provides a range of personal financial solutions for consumers. SVB Capital is the venture capital investment arm of SVB Financial Group, which focuses primarily on funds management. The Company, through its subsidiaries and divisions, offers a range of banking and financial products and services to clients across the United States. The company offers services in the technology, life science/healthcare, private equity/venture capital and wine industries. The Bank and its subsidiaries, also offer asset management, private wealth management, brokerage and other investment services.",3710,NASDAQ NMS - GLOBAL MARKET,Banking,Banks,Banks,Financials,Regional Banks,1987-10-26,US78486Q1013,https://static.finnhub.io/logo/8cd41270-80e0-11ea-8610-00000000092a.png,11868.29,Depository Credit Intermediation,Commercial Banking,Finance and Insurance,Credit Intermediation and Related Activities,SVB Financial Group,14086547400,2808053,51.740714,CALIFORNIA,https://www.svb.com
375,0.042449,914294,JBHT,"615 Jb Hunt Corporate Dr, PO Box 130",Lowell,US,USD,445658107,"J.B. Hunt Transport Services, Inc. engages in the provision of logistics solutions. The company is headquartered in Lowell, Arkansas and currently employs 27,621 full-time employees. The firm segments include Intermodal (JBI), Dedicated Contract Services (DCS), Integrated Capacity Solutions (ICS) and Truck (JBT). The Company, through its subsidiaries, provides transportation and delivery services to a range of customers and consumers throughout the continental United States, Canada and Mexico. The JBI segment draws on the intermodal services of rail carriers for the underlying linehaul movement of its equipment between rail ramps. Its DCS segment focuses on private fleet conversion and creation in replenishment, specialized equipment and final-mile delivery services. Its ICS segment provides traditional freight brokerage and transportation logistics solutions to customers through relationships with third-party carriers and integration. Its JBT segment offers full-load, dry-van freight, utilizing tractors operating over roads and highways.",29056,NASDAQ NMS - GLOBAL MARKET,Road & Rail,Transportation,Road & Rail,Industrials,Trucking,1983-01-01,US4456581077,https://static.finnhub.io/logo/23ef30d0-80e1-11ea-8c39-00000000092a.png,14343.71,General Freight Trucking,"General Freight Trucking, Long-Distance, Truckload",Transportation and Warehousing,Truck Transportation,J B Hunt Transport Services Inc,14798200000,2445416,105.507223,ARKANSAS,http://www.jbhunt.com
376,0.042073,2476651,STX,"38/39 Fitzwilliam Square, Dublin 2",DUBLIN,IE,USD,G7945M107,"Seagate Technology Plc engages in the development, production, and distribution of data storage products and electronic data storage solutions. The company is headquartered in Dublin, Dublin and currently employs 40,500 full-time employees. The firm's principal products are hard disk drives (HDDs). In addition to HDDs, it produces a range of electronic data storage products, including solid state hybrid drives, solid state drives, peripheral component interconnect express (PCIe) cards and serial advanced technology architecture (SATA) controllers. Its storage technology portfolio also includes storage subsystems and high performance computing solutions. Its products are designed for applications in enterprise servers and storage systems, client compute applications and client non-compute applications. The company designs, fabricates and assembles various components found in its disk drives, including read/write heads and recording media. Its design and manufacturing operations are based on technology platforms that are used to produce various disk drive products that serve multiple data storage applications and markets.",40500,NASDAQ NMS - GLOBAL MARKET,Technology,Technology Hardware & Equipment,"Technology Hardware, Storage & Peripherals",Information Technology,"Technology Hardware, Storage & Peripherals",2002-12-11,IE00B58JVZ52,https://static.finnhub.io/logo/b6a45070-80e0-11ea-96fc-00000000092a.png,11627.67,Computer and Peripheral Equipment Manufacturing,Computer Storage Device Manufacturing,Manufacturing,Computer and Electronic Product Manufacturing,Seagate Technology PLC,35312343136,B58JVZ5,256.624915,DUBLIN,https://www.seagate.com/
377,0.04198,1950078,WAB,30 Isabella St,Pittsburgh,US,USD,929740108,"Westinghouse Air Brake Technologies Corp. engages in the provision of equipment, systems, and value-added services for the rail industry. The company is headquartered in Pittsburgh, Pennsylvania and currently employs 18,000 full-time employees. The firm's segments include the Freight Segment and the Transit Segment. The Freight Segment primarily manufactures and services components for new and existing freight cars and locomotives, builds new switcher locomotives, rebuilds freight locomotives, supplies railway electronics, positive train control equipment, signal design and engineering services, and provides related heat exchange and cooling systems. The Transit Segment primarily manufactures and services components for new and existing passenger transit vehicles, typically regional trains, high speed trains, subway cars, light-rail vehicles and buses, builds new commuter locomotives, refurbishes subway cars, provides heating, ventilation, and air conditioning equipment, and doors for buses and subways.",27500,"NEW YORK STOCK EXCHANGE, INC.",Machinery,Capital Goods,Machinery,Industrials,Construction Machinery & Heavy Trucks,1995-06-15,US9297401088,https://static.finnhub.io/logo/9c29d5da-80ec-11ea-a77b-00000000092a.png,12793.84,Railroad Rolling Stock Manufacturing,Railroad Rolling Stock Manufacturing,Manufacturing,Transportation Equipment Manufacturing,Westinghouse Air Brake Technologies Corp,14128251000,2955733,190.299552,PENNSYLVANIA,https://www.wabtec.com/
378,0.041559,4662047,CFG,1 Citizens Plz Fl 3,Providence,US,USD,174610105,"Citizens Financial Group, Inc. engages in the provision of commercial banking services. The company is headquartered in Providence, Rhode Island and currently employs 17,800 full-time employees. The firm operates through two segments: Consumer Banking and Commercial Banking. Its Consumer Banking serves retail customers and small businesses. Consumer Banking products and services include deposit products, mortgage and home equity lending, auto financing, student loans, personal unsecured lines and loans, credit cards, business loans, wealth management and investment services. The firm's Commercial Banking segment offers a range of financial products and solutions, including lending and leasing, deposit and treasury management services, foreign exchange and interest rate risk management solutions, as well as corporate finance, merger and acquisition, and debt and equity capital markets capabilities. The firm delivers a range of retail and commercial banking products and services to individuals, institutions and companies. The firm operates approximately 1,100 branches.",18000,"NEW YORK STOCK EXCHANGE, INC.",Banking,Banks,Banks,Financials,Regional Banks,2014-09-24,US1746101054,https://static.finnhub.io/logo/7aa22fa8-80d0-11ea-b627-00000000092a.png,10854.15,Depository Credit Intermediation,Commercial Banking,Finance and Insurance,Credit Intermediation and Related Activities,Citizens Financial Group Inc,14014567000,BQRX1X3,426.828691,RHODE ISLAND,http://www.citizensbank.com
